,Issue ID,Priority,Subject,Status
1,11921,P1,P1/Oak Grove USD/Delta Dental Coalition/Transmittal not picking up correct term record/ASAP,Dev
2,12967,P1,P1 - County of Sacramento - Kaiser Medicare Transmittal Enhancements,Dev
3,13000,P1,p1/COS-Active/ HSA only button/TBD,Dev
4,13482,P1,P1/Brentwood usd/Standard vision Transmittal/8.5.2015,QA-Ready
5,12998,P1,p1/COS/ Ability to have a mailing address/TBD,QA-Started
6,13345,P1,p1/ All Clients/ Ability for COBRA and Retirees to get a LE/tbd,QA-Started
7,12481,P2,P2 / NH Enrollments - All Clients / 5-1-15,QA-UAT
